{
  "$schema": "https://json-schema.org/draft/2020-12/schema",
  "$id": "https://contracts.evesentry.invalid/schemas/esi-gateway.schema.json",
  "title": "EVE Sentry ESI Gateway health",
  "type": "object",
  "required": ["ok", "service", "version", "requests", "upstream_requests", "cache_hits", "cache_misses", "endpoints"],
  "properties": {
    "ok": {"type": "boolean"}, "service": {"const": "eve-sentry-esi-gateway"}, "version": {"type": "string"}, "uptime_seconds": {"type": "number", "minimum": 0}, "requests": {"type": "integer", "minimum": 0}, "total_requests": {"type": "integer", "minimum": 0}, "upstream_requests": {"type": "integer", "minimum": 0}, "cache_hits": {"type": "integer", "minimum": 0}, "cache_misses": {"type": "integer", "minimum": 0}, "errors": {"type": "integer", "minimum": 0}, "cache_hit_rate": {"type": "number", "minimum": 0, "maximum": 1}, "request_rate_per_second": {"type": "number", "minimum": 0}, "endpoints": {"type": "object", "additionalProperties": {"type": "object"}}, "last_error_at": {"type": ["number", "null"]}
  },
  "additionalProperties": true
}
