{
  "ok": true,
  "service": "eve-sentry-esi-gateway",
  "version": "1.0",
  "requests": 4,
  "total_requests": 4,
  "upstream_requests": 2,
  "cache_hits": 2,
  "cache_misses": 2,
  "errors": 0,
  "cache_hit_rate": 0.5,
  "endpoints": {"get_character": {"requests": 4, "cache_hits": 2, "cache_misses": 2, "upstream_requests": 2}}
}
